[
  {
    "case_id": "syn_usp_0001",
    "version": "0.1",
    "pilot": "utility_shutoff_prevention_300",
    "created_at": "2026-05-21T09:00:00-07:00",
    "channel": "synthetic",
    "applicant": {
      "self_reported_name": "Maya R.",
      "age_range": "35-44",
      "preferred_language": "en",
      "contact_methods": ["sms"],
      "address": {
        "city": "Oakland",
        "state": "CA",
        "postal_code": "94607"
      }
    },
    "household": {
      "adults": 1,
      "children": 2,
      "monthly_income_usd": 2450,
      "housing_status": "renter"
    },
    "request": {
      "utility_type": "electric",
      "amount_due_usd": 214.73,
      "amount_requested_usd": 214.73,
      "shutoff_date": "2026-05-24",
      "vendor": "East Bay Electric",
      "account_last4": "1182",
      "payment_route": "direct_to_vendor"
    },
    "evidence": [
      {
        "type": "shutoff_notice",
        "status": "provided",
        "issued_at": "2026-05-15",
        "matches_applicant": true,
        "notes": "Notice shows applicant name, service address, vendor, account ending 1182, amount due, and shutoff date."
      },
      {
        "type": "vendor_payment_route",
        "status": "provided",
        "issued_at": null,
        "matches_applicant": true,
        "notes": "Vendor online guest payment route is available."
      }
    ],
    "narrative": "Applicant missed work after a child-care disruption and needs a one-time payment to stop electric shutoff.",
    "risk_flags": [],
    "ground_truth": {
      "expected_decision": "approve",
      "expected_amount_usd": 214.73,
      "case_type": "eligible_clear",
      "reason": "Within cap, imminent shutoff, direct vendor payment route, and required evidence is present."
    }
  },
  {
    "case_id": "syn_usp_0002",
    "version": "0.1",
    "pilot": "utility_shutoff_prevention_300",
    "created_at": "2026-05-21T09:10:00-07:00",
    "channel": "synthetic",
    "applicant": {
      "self_reported_name": "Darren P.",
      "age_range": "45-54",
      "preferred_language": "en",
      "contact_methods": ["email"],
      "address": {
        "city": "Richmond",
        "state": "CA",
        "postal_code": "94801"
      }
    },
    "household": {
      "adults": 2,
      "children": 0,
      "monthly_income_usd": 3100,
      "housing_status": "renter"
    },
    "request": {
      "utility_type": "water",
      "amount_due_usd": 189.2,
      "amount_requested_usd": 189.2,
      "shutoff_date": "2026-05-29",
      "vendor": "Richmond Municipal Water",
      "account_last4": null,
      "payment_route": "unknown"
    },
    "evidence": [
      {
        "type": "applicant_statement",
        "status": "provided",
        "issued_at": null,
        "matches_applicant": true,
        "notes": "Applicant states a water shutoff notice was received but has not uploaded it."
      },
      {
        "type": "shutoff_notice",
        "status": "missing",
        "issued_at": null,
        "matches_applicant": false,
        "notes": "Notice needed to verify amount, date, and account."
      }
    ],
    "narrative": "Applicant says the water will be shut off next week but needs help finding the notice.",
    "risk_flags": [],
    "ground_truth": {
      "expected_decision": "needs_more_info",
      "expected_amount_usd": null,
      "case_type": "missing_evidence",
      "reason": "Potentially eligible, but required notice, account identifier, and direct vendor payment route are missing."
    }
  },
  {
    "case_id": "syn_usp_0003",
    "version": "0.1",
    "pilot": "utility_shutoff_prevention_300",
    "created_at": "2026-05-21T09:20:00-07:00",
    "channel": "synthetic",
    "applicant": {
      "self_reported_name": "Elena S.",
      "age_range": "25-34",
      "preferred_language": "es",
      "contact_methods": ["sms", "phone"],
      "address": {
        "city": "San Leandro",
        "state": "CA",
        "postal_code": "94577"
      }
    },
    "household": {
      "adults": 2,
      "children": 1,
      "monthly_income_usd": 2700,
      "housing_status": "renter"
    },
    "request": {
      "utility_type": "gas",
      "amount_due_usd": 463.8,
      "amount_requested_usd": 463.8,
      "shutoff_date": "2026-05-25",
      "vendor": "Bay Gas",
      "account_last4": "4420",
      "payment_route": "direct_to_vendor"
    },
    "evidence": [
      {
        "type": "shutoff_notice",
        "status": "provided",
        "issued_at": "2026-05-14",
        "matches_applicant": true,
        "notes": "Notice appears valid and matches applicant."
      }
    ],
    "narrative": "Applicant requests the full overdue gas balance to avoid shutoff.",
    "risk_flags": [],
    "ground_truth": {
      "expected_decision": "deny",
      "expected_amount_usd": null,
      "case_type": "over_cap",
      "reason": "Requested amount exceeds the $300 cap and the case does not state that a partial payment would prevent shutoff."
    }
  },
  {
    "case_id": "syn_usp_0004",
    "version": "0.1",
    "pilot": "utility_shutoff_prevention_300",
    "created_at": "2026-05-21T09:30:00-07:00",
    "channel": "synthetic",
    "applicant": {
      "self_reported_name": "Tomas W.",
      "age_range": "55-64",
      "preferred_language": "en",
      "contact_methods": ["phone"],
      "address": {
        "city": "Berkeley",
        "state": "CA",
        "postal_code": "94703"
      }
    },
    "household": {
      "adults": 1,
      "children": 0,
      "monthly_income_usd": 1900,
      "housing_status": "renter"
    },
    "request": {
      "utility_type": "internet",
      "amount_due_usd": 96.33,
      "amount_requested_usd": 96.33,
      "shutoff_date": "2026-05-27",
      "vendor": "MetroNet",
      "account_last4": "8021",
      "payment_route": "direct_to_vendor"
    },
    "evidence": [
      {
        "type": "utility_bill",
        "status": "provided",
        "issued_at": "2026-05-10",
        "matches_applicant": true,
        "notes": "Internet service bill shows past-due amount."
      }
    ],
    "narrative": "Applicant needs internet to apply for jobs and attend telehealth appointments.",
    "risk_flags": [],
    "ground_truth": {
      "expected_decision": "deny",
      "expected_amount_usd": null,
      "case_type": "out_of_scope_utility",
      "reason": "Internet service is outside the v1 utility scope even though the hardship is plausible."
    }
  },
  {
    "case_id": "syn_usp_0005",
    "version": "0.1",
    "pilot": "utility_shutoff_prevention_300",
    "created_at": "2026-05-21T09:40:00-07:00",
    "channel": "synthetic",
    "applicant": {
      "self_reported_name": "Ari K.",
      "age_range": "25-34",
      "preferred_language": "en",
      "contact_methods": ["email"],
      "address": {
        "city": "Oakland",
        "state": "CA",
        "postal_code": "94612"
      }
    },
    "household": {
      "adults": 3,
      "children": 0,
      "monthly_income_usd": 3600,
      "housing_status": "temporary_housing"
    },
    "request": {
      "utility_type": "electric",
      "amount_due_usd": 155.4,
      "amount_requested_usd": 155.4,
      "shutoff_date": "2026-05-26",
      "vendor": "East Bay Electric",
      "account_last4": "9104",
      "payment_route": "direct_to_vendor"
    },
    "evidence": [
      {
        "type": "shutoff_notice",
        "status": "provided",
        "issued_at": "2026-05-16",
        "matches_applicant": false,
        "notes": "Notice is for a different name at the same address. Applicant says the account belongs to a roommate."
      }
    ],
    "narrative": "Applicant shares the household utility account with a roommate and is contributing to prevent shutoff.",
    "risk_flags": [
      {
        "code": "name_mismatch",
        "severity": "medium",
        "description": "Utility account holder does not match applicant."
      }
    ],
    "ground_truth": {
      "expected_decision": "needs_review",
      "expected_amount_usd": null,
      "case_type": "relationship_ambiguity",
      "reason": "Case may be legitimate, but account-holder relationship requires manual verification."
    }
  },
  {
    "case_id": "syn_usp_0006",
    "version": "0.1",
    "pilot": "utility_shutoff_prevention_300",
    "created_at": "2026-05-21T09:50:00-07:00",
    "channel": "synthetic",
    "applicant": {
      "self_reported_name": "Nina J.",
      "age_range": "65+",
      "preferred_language": "en",
      "contact_methods": ["phone"],
      "address": {
        "city": "Alameda",
        "state": "CA",
        "postal_code": "94501"
      }
    },
    "household": {
      "adults": 1,
      "children": 0,
      "monthly_income_usd": 1650,
      "housing_status": "owner"
    },
    "request": {
      "utility_type": "municipal_bundle",
      "amount_due_usd": 238.02,
      "amount_requested_usd": 238.02,
      "shutoff_date": "2026-05-18",
      "vendor": "Alameda Municipal Utilities",
      "account_last4": "2208",
      "payment_route": "direct_to_vendor"
    },
    "evidence": [
      {
        "type": "shutoff_notice",
        "status": "provided",
        "issued_at": "2026-05-05",
        "matches_applicant": true,
        "notes": "Notice shows shutoff date has already passed."
      }
    ],
    "narrative": "Applicant says service may already be interrupted and asks for help restoring it.",
    "risk_flags": [],
    "ground_truth": {
      "expected_decision": "deny",
      "expected_amount_usd": null,
      "case_type": "post_shutoff",
      "reason": "Reconnection after shutoff is outside the v1 prevention-only policy."
    }
  },
  {
    "case_id": "syn_usp_0007",
    "version": "0.1",
    "pilot": "utility_shutoff_prevention_300",
    "created_at": "2026-05-21T10:00:00-07:00",
    "channel": "synthetic",
    "applicant": {
      "self_reported_name": "Jon B.",
      "age_range": "35-44",
      "preferred_language": "en",
      "contact_methods": ["email"],
      "address": {